    1  00:39:37.137775 IP 10.42.53.132.50000 > 52.41.70.31.5201: Flags [SEW], seq 2445669383, win 65535, options [mss 1460,nop,wscale 5,mptcp capable v1,nop,nop,TS val 1979236006 ecr 0,sackOK,eol], length 0
    2  00:39:37.170396 IP 52.41.70.31.5201 > 10.42.53.132.50000: Flags [S.E], seq 436714502, ack 2445669384, win 62503, options [mss 1460,sackOK,TS val 3534614510 ecr 1979236006,nop,wscale 7,mptcp capable v1 csum {0xe2232841fa0ef689}], length 0
    3  00:39:37.170841 IP 10.42.53.132.50000 > 52.41.70.31.5201: Flags [.], ack 1, win 4096, options [nop,nop,TS val 1979236040 ecr 3534614510,mptcp capable v1 csum {0x406125b6882119e6,0xe2232841fa0ef689}], length 0
    4  00:39:37.442941 IP 10.42.53.132.50000 > 52.41.70.31.5201: Flags [.], seq 1:1429, ack 1, win 4096, options [nop,nop,TS val 1979236312 ecr 3534614510,mptcp dss ack 3789686029 seq 804902517 subseq 1 len 2000 csum 0x6e5d], length 1428
    5  00:39:37.443316 IP 10.42.53.132.50000 > 52.41.70.31.5201: Flags [P.], seq 1429:2001, ack 1, win 4096, options [nop,nop,TS val 1979236312 ecr 3534614510,mptcp dss ack 3789686029 seq 804902517 subseq 1 len 2000 csum 0x6e5d], length 572
    6  00:39:37.477636 IP 52.41.70.31.5201 > 10.42.53.132.50000: Flags [.], ack 2001, win 489, options [nop,nop,TS val 3534614818 ecr 1979236312,mptcp dss ack 4066747377], length 0
    7  00:39:37.720126 IP 10.42.53.132.50000 > 52.41.70.31.5201: Flags [.], seq 2001:3429, ack 1, win 4096, options [nop,nop,TS val 1979236590 ecr 3534614818,mptcp dss ack 3789686029 seq 804904517 subseq 2001 len 2000 csum 0x5ebd], length 1428
    8  00:39:37.720692 IP 10.42.53.132.50000 > 52.41.70.31.5201: Flags [P.], seq 3429:4001, ack 1, win 4096, options [nop,nop,TS val 1979236590 ecr 3534614818,mptcp dss ack 3789686029 seq 804904517 subseq 2001 len 2000 csum 0x5ebd], length 572
    9  00:39:37.757365 IP 52.41.70.31.5201 > 10.42.53.132.50000: Flags [.], ack 4001, win 489, options [nop,nop,TS val 3534615097 ecr 1979236590,mptcp dss ack 4066747377], length 0
   10  00:39:37.994760 IP 10.42.53.132.50000 > 52.41.70.31.5201: Flags [.], seq 4001:5429, ack 1, win 4096, options [nop,nop,TS val 1979236864 ecr 3534615097,mptcp dss ack 3789686029 seq 804906517 subseq 4001 len 2000 csum 0x4f1d], length 1428
   11  00:39:37.995403 IP 10.42.53.132.50000 > 52.41.70.31.5201: Flags [P.], seq 5429:6001, ack 1, win 4096, options [nop,nop,TS val 1979236864 ecr 3534615097,mptcp dss ack 3789686029 seq 804906517 subseq 4001 len 2000 csum 0x4f1d], length 572
   12  00:39:38.029046 IP 52.41.70.31.5201 > 10.42.53.132.50000: Flags [.], ack 6001, win 489, options [nop,nop,TS val 3534615369 ecr 1979236864,mptcp dss ack 4066747377], length 0
   13  00:39:38.267944 IP 10.42.53.132.50000 > 52.41.70.31.5201: Flags [.], seq 6001:7429, ack 1, win 4096, options [nop,nop,TS val 1979237137 ecr 3534615369,mptcp dss ack 3789686029 seq 804908517 subseq 6001 len 2000 csum 0x3f7d], length 1428
   14  00:39:38.268427 IP 10.42.53.132.50000 > 52.41.70.31.5201: Flags [P.], seq 7429:8001, ack 1, win 4096, options [nop,nop,TS val 1979237137 ecr 3534615369,mptcp dss ack 3789686029 seq 804908517 subseq 6001 len 2000 csum 0x3f7d], length 572
   15  00:39:38.297897 IP 52.41.70.31.5201 > 10.42.53.132.50000: Flags [.], ack 7429, win 489, options [nop,nop,TS val 3534615637 ecr 1979237137,mptcp dss ack 4066747377], length 0
   16  00:39:38.297904 IP 52.41.70.31.5201 > 10.42.53.132.50000: Flags [.], ack 8001, win 489, options [nop,nop,TS val 3534615637 ecr 1979237137,mptcp dss ack 4066747377], length 0
   17  00:39:38.541641 IP 10.42.53.132.50000 > 52.41.70.31.5201: Flags [.], seq 8001:9429, ack 1, win 4096, options [nop,nop,TS val 1979237410 ecr 3534615637,mptcp dss ack 3789686029 seq 804910517 subseq 8001 len 2000 csum 0x2fdd], length 1428
   18  00:39:38.541981 IP 10.42.53.132.50000 > 52.41.70.31.5201: Flags [P.], seq 9429:10001, ack 1, win 4096, options [nop,nop,TS val 1979237410 ecr 3534615637,mptcp dss ack 3789686029 seq 804910517 subseq 8001 len 2000 csum 0x2fdd], length 572
   19  00:39:38.574796 IP 52.41.70.31.5201 > 10.42.53.132.50000: Flags [.], ack 10001, win 489, options [nop,nop,TS val 3534615915 ecr 1979237410,mptcp dss ack 4066747377], length 0
   20  00:39:38.812374 IP 10.42.53.132.50000 > 52.41.70.31.5201: Flags [.], seq 10001:11429, ack 1, win 4096, options [nop,nop,TS val 1979237681 ecr 3534615915,mptcp dss ack 3789686029 seq 804912517 subseq 10001 len 2000 csum 0x203d], length 1428
   21  00:39:38.812755 IP 10.42.53.132.50000 > 52.41.70.31.5201: Flags [P.], seq 11429:12001, ack 1, win 4096, options [nop,nop,TS val 1979237681 ecr 3534615915,mptcp dss ack 3789686029 seq 804912517 subseq 10001 len 2000 csum 0x203d], length 572
   22  00:39:38.847783 IP 52.41.70.31.5201 > 10.42.53.132.50000: Flags [.], ack 12001, win 489, options [nop,nop,TS val 3534616187 ecr 1979237681,mptcp dss ack 4066747377], length 0
   23  00:39:39.082768 IP 10.42.53.132.50000 > 52.41.70.31.5201: Flags [.], seq 12001:13429, ack 1, win 4096, options [nop,nop,TS val 1979237952 ecr 3534616187,mptcp dss ack 3789686029 seq 804914517 subseq 12001 len 2000 csum 0x109d], length 1428
   24  00:39:39.083181 IP 10.42.53.132.50000 > 52.41.70.31.5201: Flags [P.], seq 13429:14001, ack 1, win 4096, options [nop,nop,TS val 1979237952 ecr 3534616187,mptcp dss ack 3789686029 seq 804914517 subseq 12001 len 2000 csum 0x109d], length 572
   25  00:39:39.114818 IP 52.41.70.31.5201 > 10.42.53.132.50000: Flags [.], ack 14001, win 489, options [nop,nop,TS val 3534616455 ecr 1979237952,mptcp dss ack 4066747377], length 0
   26  00:39:39.356407 IP 10.42.53.132.50000 > 52.41.70.31.5201: Flags [.], seq 14001:15429, ack 1, win 4096, options [nop,nop,TS val 1979238225 ecr 3534616455,mptcp dss ack 3789686029 seq 804916517 subseq 14001 len 2000 csum 0xfd], length 1428
   27  00:39:39.356646 IP 10.42.53.132.50000 > 52.41.70.31.5201: Flags [P.], seq 15429:16001, ack 1, win 4096, options [nop,nop,TS val 1979238225 ecr 3534616455,mptcp dss ack 3789686029 seq 804916517 subseq 14001 len 2000 csum 0xfd], length 572
   28  00:39:39.389941 IP 52.41.70.31.5201 > 10.42.53.132.50000: Flags [.], ack 16001, win 489, options [nop,nop,TS val 3534616730 ecr 1979238225,mptcp dss ack 4066747377], length 0
   29  00:39:39.629144 IP 10.42.53.132.50000 > 52.41.70.31.5201: Flags [.], seq 16001:17429, ack 1, win 4096, options [nop,nop,TS val 1979238498 ecr 3534616730,mptcp dss ack 3789686029 seq 804918517 subseq 16001 len 2000 csum 0xf15c], length 1428
   30  00:39:39.629494 IP 10.42.53.132.50000 > 52.41.70.31.5201: Flags [P.], seq 17429:18001, ack 1, win 4096, options [nop,nop,TS val 1979238498 ecr 3534616730,mptcp dss ack 3789686029 seq 804918517 subseq 16001 len 2000 csum 0xf15c], length 572
   31  00:39:39.663459 IP 52.41.70.31.5201 > 10.42.53.132.50000: Flags [.], ack 18001, win 489, options [nop,nop,TS val 3534617003 ecr 1979238498,mptcp dss ack 4066747377], length 0
   32  00:39:39.902571 IP 10.42.53.132.50000 > 52.41.70.31.5201: Flags [.], seq 18001:19429, ack 1, win 4096, options [nop,nop,TS val 1979238771 ecr 3534617003,mptcp dss ack 3789686029 seq 804920517 subseq 18001 len 2000 csum 0xe1bc], length 1428
   33  00:39:39.902952 IP 10.42.53.132.50000 > 52.41.70.31.5201: Flags [P.], seq 19429:20001, ack 1, win 4096, options [nop,nop,TS val 1979238771 ecr 3534617003,mptcp dss ack 3789686029 seq 804920517 subseq 18001 len 2000 csum 0xe1bc], length 572
   34  00:39:39.933905 IP 52.41.70.31.5201 > 10.42.53.132.50000: Flags [.], ack 20001, win 489, options [nop,nop,TS val 3534617274 ecr 1979238771,mptcp dss ack 4066747377], length 0
   35  00:39:58.804111 IP 10.42.53.132.50000 > 52.41.70.31.5201: Flags [F.], seq 20001, ack 1, win 4096, options [nop,nop,TS val 1979257673 ecr 3534617274,mptcp dss fin ack 3789686029 seq 804922517 subseq 0 len 1 csum 0xef4], length 0
   36  00:39:58.957138 IP 52.41.70.31.5201 > 10.42.53.132.50000: Flags [.], ack 20002, win 489, options [nop,nop,TS val 3534636218 ecr 1979257673,mptcp dss ack 4066747377], length 0
   37  00:40:04.842768 IP 10.42.53.132.50002 > 52.41.70.31.5201: Flags [SEW], seq 3111594058, win 65535, options [mss 1460,nop,wscale 5,mptcp capable v0 {0x10b4a985eac6e5d9},nop,nop,TS val 3192558561 ecr 0,sackOK,eol], length 0
   38  00:40:04.875615 IP 52.41.70.31.5201 > 10.42.53.132.50002: Flags [S.E], seq 3152720739, ack 3111594059, win 62503, options [mss 1460,sackOK,TS val 3534642216 ecr 3192558561,nop,wscale 7,mptcp capable v0 csum {0x580fe1c914225d29}], length 0
   39  00:40:04.876039 IP 10.42.53.132.50002 > 52.41.70.31.5201: Flags [.], ack 1, win 4096, options [nop,nop,TS val 3192558595 ecr 3534642216,mptcp capable v0 csum {0x10b4a985eac6e5d9,0x580fe1c914225d29}], length 0
   40  00:40:05.154315 IP 10.42.53.132.50002 > 52.41.70.31.5201: Flags [.], seq 1:1429, ack 1, win 4096, options [nop,nop,TS val 3192558874 ecr 3534642216,mptcp dss ack 1179770297 seq 3554115263 subseq 1 len 2000 csum 0x7010], length 1428
   41  00:40:05.154811 IP 10.42.53.132.50002 > 52.41.70.31.5201: Flags [P.], seq 1429:2001, ack 1, win 4096, options [nop,nop,TS val 3192558874 ecr 3534642216,mptcp dss ack 1179770297 seq 3554115263 subseq 1 len 2000 csum 0x7010], length 572
   42  00:40:05.189482 IP 52.41.70.31.5201 > 10.42.53.132.50002: Flags [.], ack 2001, win 473, options [nop,nop,TS val 3534642530 ecr 3192558874,mptcp dss ack 3554117263], length 0
   43  00:40:05.190047 IP6 2607:fb90:3635:797b:5986:1647:4961:b852.50003 > 2607:7700:0:13::3429:461f.5201: Flags [S], seq 1266509227, win 0, options [mss 1404,nop,wscale 5,mptcp join backup id 3 token 0x15110639 nonce 0xda4cb2e9,nop,nop,TS val 590899905 ecr 0,sackOK,eol], length 0
   44  00:40:05.190415 IP 52.41.70.31.5201 > 10.42.53.132.50002: Flags [P.], seq 1:1025, ack 2001, win 473, options [nop,nop,TS val 3534642530 ecr 3192558874,mptcp dss ack 3554117263 seq 1179770297 subseq 1 len 1024 csum 0xe70b], length 1024
   45  00:40:05.190591 IP 10.42.53.132.50002 > 52.41.70.31.5201: Flags [.], ack 1025, win 8169, options [nop,nop,TS val 3192558909 ecr 3534642530,mptcp dss ack 1179771321], length 0
   46  00:40:05.215041 IP 52.41.70.31.5201 > 10.42.53.132.50002: Flags [P.], seq 1025:2001, ack 2001, win 473, options [nop,nop,TS val 3534642556 ecr 3192558874,mptcp dss ack 3554117263 seq 1179771321 subseq 1025 len 976 csum 0xfd59], length 976
   47  00:40:05.215262 IP 10.42.53.132.50002 > 52.41.70.31.5201: Flags [.], ack 2001, win 8171, options [nop,nop,TS val 3192558934 ecr 3534642556,mptcp dss ack 1179772297], length 0
   48  00:40:05.402743 IP6 2607:7700:0:13::3429:461f.5201 > 2607:fb90:3635:797b:5986:1647:4961:b852.50003: Flags [S.], seq 3531829736, ack 1266509228, win 62503, options [mss 1400,sackOK,TS val 1772841781 ecr 590899905,nop,wscale 7,mptcp join id 0 hmac 0xaf8488892c4f796b nonce 0xe34303eb], length 0
   49  00:40:05.403113 IP6 2607:fb90:3635:797b:5986:1647:4961:b852.50003 > 2607:7700:0:13::3429:461f.5201: Flags [.], ack 1, win 8201, options [nop,nop,TS val 590900118 ecr 1772841781,mptcp join hmac 0xd65ad8e33a106f374b4a6e9b11f4a5739ad65260], length 0
   50  00:40:05.415737 IP 10.42.53.132.50002 > 52.41.70.31.5201: Flags [.], seq 2001:3429, ack 2001, win 8201, options [nop,nop,TS val 3192559134 ecr 3534642556,mptcp dss ack 1179772297 seq 3554117263 subseq 2001 len 2000 csum 0x6070], length 1428
   51  00:40:05.416296 IP 10.42.53.132.50002 > 52.41.70.31.5201: Flags [P.], seq 3429:4001, ack 2001, win 8201, options [nop,nop,TS val 3192559134 ecr 3534642556,mptcp dss ack 1179772297 seq 3554117263 subseq 2001 len 2000 csum 0x6070], length 572
   52  00:40:05.441032 IP 52.41.70.31.5201 > 10.42.53.132.50002: Flags [.], ack 3429, win 473, options [nop,nop,TS val 3534642782 ecr 3192559134,mptcp dss ack 3554117263], length 0
   53  00:40:05.441040 IP 52.41.70.31.5201 > 10.42.53.132.50002: Flags [.], ack 4001, win 458, options [nop,nop,TS val 3534642783 ecr 3192559134,mptcp dss ack 3554119263], length 0
   54  00:40:05.442083 IP 52.41.70.31.5201 > 10.42.53.132.50002: Flags [P.], seq 2001:3025, ack 4001, win 458, options [nop,nop,TS val 3534642783 ecr 3192559134,mptcp dss ack 3554119263 seq 1179772297 subseq 2001 len 1024 csum 0xd76b], length 1024
   55  00:40:05.442295 IP 10.42.53.132.50002 > 52.41.70.31.5201: Flags [.], ack 3025, win 8177, options [nop,nop,TS val 3192559161 ecr 3534642783,mptcp dss ack 1179773321], length 0
   56  00:40:05.466865 IP 52.41.70.31.5201 > 10.42.53.132.50002: Flags [P.], seq 3025:4001, ack 4001, win 458, options [nop,nop,TS val 3534642808 ecr 3192559134,mptcp dss ack 3554119263 seq 1179773321 subseq 3025 len 976 csum 0xedb9], length 976
   57  00:40:05.467081 IP 10.42.53.132.50002 > 52.41.70.31.5201: Flags [.], ack 4001, win 8179, options [nop,nop,TS val 3192559186 ecr 3534642808,mptcp dss ack 1179774297], length 0
   58  00:40:05.486017 IP6 2607:7700:0:13::3429:461f.5201 > 2607:fb90:3635:797b:5986:1647:4961:b852.50003: Flags [.], ack 1, win 884, options [nop,nop,TS val 1772841860 ecr 590900118,mptcp dss ack 3554119263], length 0
   59  00:40:05.688707 IP 10.42.53.132.50002 > 52.41.70.31.5201: Flags [.], seq 4001:5429, ack 4001, win 8209, options [nop,nop,TS val 3192559407 ecr 3534642808,mptcp dss ack 1179774297 seq 3554119263 subseq 4001 len 2000 csum 0x50d0], length 1428
   60  00:40:05.689231 IP 10.42.53.132.50002 > 52.41.70.31.5201: Flags [P.], seq 5429:6001, ack 4001, win 8209, options [nop,nop,TS val 3192559407 ecr 3534642808,mptcp dss ack 1179774297 seq 3554119263 subseq 4001 len 2000 csum 0x50d0], length 572
   61  00:40:05.720748 IP 52.41.70.31.5201 > 10.42.53.132.50002: Flags [.], ack 5429, win 884, options [nop,nop,TS val 3534643062 ecr 3192559407,mptcp dss ack 3554119263], length 0
   62  00:40:05.720756 IP 52.41.70.31.5201 > 10.42.53.132.50002: Flags [.], ack 6001, win 884, options [nop,nop,TS val 3534643062 ecr 3192559407,mptcp dss ack 3554121263], length 0
   63  00:40:05.720761 IP 52.41.70.31.5201 > 10.42.53.132.50002: Flags [P.], seq 4001:5025, ack 6001, win 884, options [nop,nop,TS val 3534643062 ecr 3192559407,mptcp dss ack 3554121263 seq 1179774297 subseq 4001 len 1024 csum 0xc7cb], length 1024
   64  00:40:05.721035 IP 10.42.53.132.50002 > 52.41.70.31.5201: Flags [.], ack 5025, win 8177, options [nop,nop,TS val 3192559440 ecr 3534643062,mptcp dss ack 1179775321], length 0
   65  00:40:05.745645 IP 52.41.70.31.5201 > 10.42.53.132.50002: Flags [P.], seq 5025:6001, ack 6001, win 884, options [nop,nop,TS val 3534643087 ecr 3192559407,mptcp dss ack 3554121263 seq 1179775321 subseq 5025 len 976 csum 0xde19], length 976
   66  00:40:05.745856 IP 10.42.53.132.50002 > 52.41.70.31.5201: Flags [.], ack 6001, win 8179, options [nop,nop,TS val 3192559465 ecr 3534643087,mptcp dss ack 1179776297], length 0
   67  00:40:05.957675 IP 10.42.53.132.50002 > 52.41.70.31.5201: Flags [.], seq 6001:7429, ack 6001, win 8209, options [nop,nop,TS val 3192559676 ecr 3534643087,mptcp dss ack 1179776297 seq 3554121263 subseq 6001 len 2000 csum 0x4130], length 1428
   68  00:40:05.958008 IP 10.42.53.132.50002 > 52.41.70.31.5201: Flags [P.], seq 7429:8001, ack 6001, win 8209, options [nop,nop,TS val 3192559676 ecr 3534643087,mptcp dss ack 1179776297 seq 3554121263 subseq 6001 len 2000 csum 0x4130], length 572
   69  00:40:05.989951 IP 52.41.70.31.5201 > 10.42.53.132.50002: Flags [.], ack 8001, win 884, options [nop,nop,TS val 3534643331 ecr 3192559676,mptcp dss ack 3554123263], length 0
   70  00:40:05.990786 IP 52.41.70.31.5201 > 10.42.53.132.50002: Flags [P.], seq 6001:7025, ack 8001, win 884, options [nop,nop,TS val 3534643332 ecr 3192559676,mptcp dss ack 3554123263 seq 1179776297 subseq 6001 len 1024 csum 0xb82b], length 1024
   71  00:40:05.990974 IP 10.42.53.132.50002 > 52.41.70.31.5201: Flags [.], ack 7025, win 8177, options [nop,nop,TS val 3192559709 ecr 3534643332,mptcp dss ack 1179777321], length 0
   72  00:40:06.016403 IP 52.41.70.31.5201 > 10.42.53.132.50002: Flags [P.], seq 7025:8001, ack 8001, win 884, options [nop,nop,TS val 3534643357 ecr 3192559676,mptcp dss ack 3554123263 seq 1179777321 subseq 7025 len 976 csum 0xce79], length 976
   73  00:40:06.016614 IP 10.42.53.132.50002 > 52.41.70.31.5201: Flags [.], ack 8001, win 8179, options [nop,nop,TS val 3192559736 ecr 3534643357,mptcp dss ack 1179778297], length 0
   74  00:40:06.234525 IP 10.42.53.132.50002 > 52.41.70.31.5201: Flags [.], seq 8001:9429, ack 8001, win 8209, options [nop,nop,TS val 3192559954 ecr 3534643357,mptcp dss ack 1179778297 seq 3554123263 subseq 8001 len 2000 csum 0x3190], length 1428
   75  00:40:06.235063 IP 10.42.53.132.50002 > 52.41.70.31.5201: Flags [P.], seq 9429:10001, ack 8001, win 8209, options [nop,nop,TS val 3192559954 ecr 3534643357,mptcp dss ack 1179778297 seq 3554123263 subseq 8001 len 2000 csum 0x3190], length 572
   76  00:40:06.267196 IP 52.41.70.31.5201 > 10.42.53.132.50002: Flags [.], ack 10001, win 884, options [nop,nop,TS val 3534643608 ecr 3192559954,mptcp dss ack 3554125263], length 0
   77  00:40:06.267205 IP 52.41.70.31.5201 > 10.42.53.132.50002: Flags [P.], seq 8001:9025, ack 10001, win 884, options [nop,nop,TS val 3534643608 ecr 3192559954,mptcp dss ack 3554125263 seq 1179778297 subseq 8001 len 1024 csum 0xa88b], length 1024
   78  00:40:06.267457 IP 10.42.53.132.50002 > 52.41.70.31.5201: Flags [.], ack 9025, win 8177, options [nop,nop,TS val 3192559987 ecr 3534643608,mptcp dss ack 1179779321], length 0
   79  00:40:06.291996 IP 52.41.70.31.5201 > 10.42.53.132.50002: Flags [P.], seq 9025:10001, ack 10001, win 884, options [nop,nop,TS val 3534643633 ecr 3192559954,mptcp dss ack 3554125263 seq 1179779321 subseq 9025 len 976 csum 0xbed9], length 976
   80  00:40:06.292223 IP 10.42.53.132.50002 > 52.41.70.31.5201: Flags [.], ack 10001, win 8179, options [nop,nop,TS val 3192560011 ecr 3534643633,mptcp dss ack 1179780297], length 0
   81  00:40:06.504345 IP 10.42.53.132.50002 > 52.41.70.31.5201: Flags [.], seq 10001:11429, ack 10001, win 8209, options [nop,nop,TS val 3192560223 ecr 3534643633,mptcp dss ack 1179780297 seq 3554125263 subseq 10001 len 2000 csum 0x21f0], length 1428
   82  00:40:06.504831 IP 10.42.53.132.50002 > 52.41.70.31.5201: Flags [P.], seq 11429:12001, ack 10001, win 8209, options [nop,nop,TS val 3192560223 ecr 3534643633,mptcp dss ack 1179780297 seq 3554125263 subseq 10001 len 2000 csum 0x21f0], length 572
   83  00:40:06.537138 IP 52.41.70.31.5201 > 10.42.53.132.50002: Flags [.], ack 12001, win 884, options [nop,nop,TS val 3534643878 ecr 3192560223,mptcp dss ack 3554127263], length 0
   84  00:40:06.537146 IP 52.41.70.31.5201 > 10.42.53.132.50002: Flags [P.], seq 10001:11025, ack 12001, win 884, options [nop,nop,TS val 3534643878 ecr 3192560223,mptcp dss ack 3554127263 seq 1179780297 subseq 10001 len 1024 csum 0x98eb], length 1024
   85  00:40:06.537415 IP 10.42.53.132.50002 > 52.41.70.31.5201: Flags [.], ack 11025, win 8177, options [nop,nop,TS val 3192560257 ecr 3534643878,mptcp dss ack 1179781321], length 0
   86  00:40:06.577735 IP 52.41.70.31.5201 > 10.42.53.132.50002: Flags [P.], seq 11025:12001, ack 12001, win 884, options [nop,nop,TS val 3534643903 ecr 3192560223,mptcp dss ack 3554127263 seq 1179781321 subseq 11025 len 976 csum 0xaf39], length 976
   87  00:40:06.577956 IP 10.42.53.132.50002 > 52.41.70.31.5201: Flags [.], ack 12001, win 8179, options [nop,nop,TS val 3192560297 ecr 3534643903,mptcp dss ack 1179782297], length 0
   88  00:40:06.774201 IP 10.42.53.132.50002 > 52.41.70.31.5201: Flags [.], seq 12001:13429, ack 12001, win 8209, options [nop,nop,TS val 3192560493 ecr 3534643903,mptcp dss ack 1179782297 seq 3554127263 subseq 12001 len 2000 csum 0x1250], length 1428
   89  00:40:06.774569 IP 10.42.53.132.50002 > 52.41.70.31.5201: Flags [P.], seq 13429:14001, ack 12001, win 8209, options [nop,nop,TS val 3192560493 ecr 3534643903,mptcp dss ack 1179782297 seq 3554127263 subseq 12001 len 2000 csum 0x1250], length 572
   90  00:40:06.806261 IP 52.41.70.31.5201 > 10.42.53.132.50002: Flags [.], ack 14001, win 884, options [nop,nop,TS val 3534644148 ecr 3192560493,mptcp dss ack 3554129263], length 0
   91  00:40:06.807298 IP 52.41.70.31.5201 > 10.42.53.132.50002: Flags [P.], seq 12001:13025, ack 14001, win 884, options [nop,nop,TS val 3534644148 ecr 3192560493,mptcp dss ack 3554129263 seq 1179782297 subseq 12001 len 1024 csum 0x894b], length 1024
   92  00:40:06.807494 IP 10.42.53.132.50002 > 52.41.70.31.5201: Flags [.], ack 13025, win 8177, options [nop,nop,TS val 3192560527 ecr 3534644148,mptcp dss ack 1179783321], length 0
   93  00:40:06.832167 IP 52.41.70.31.5201 > 10.42.53.132.50002: Flags [P.], seq 13025:14001, ack 14001, win 884, options [nop,nop,TS val 3534644173 ecr 3192560493,mptcp dss ack 3554129263 seq 1179783321 subseq 13025 len 976 csum 0x9f99], length 976
   94  00:40:06.832400 IP 10.42.53.132.50002 > 52.41.70.31.5201: Flags [.], ack 14001, win 8179, options [nop,nop,TS val 3192560552 ecr 3534644173,mptcp dss ack 1179784297], length 0
   95  00:40:07.043890 IP 10.42.53.132.50002 > 52.41.70.31.5201: Flags [.], seq 14001:15429, ack 14001, win 8209, options [nop,nop,TS val 3192560762 ecr 3534644173,mptcp dss ack 1179784297 seq 3554129263 subseq 14001 len 2000 csum 0x2b0], length 1428
   96  00:40:07.044329 IP 10.42.53.132.50002 > 52.41.70.31.5201: Flags [P.], seq 15429:16001, ack 14001, win 8209, options [nop,nop,TS val 3192560762 ecr 3534644173,mptcp dss ack 1179784297 seq 3554129263 subseq 14001 len 2000 csum 0x2b0], length 572
   97  00:40:07.071198 IP 52.41.70.31.5201 > 10.42.53.132.50002: Flags [.], ack 16001, win 884, options [nop,nop,TS val 3534644412 ecr 3192560762,mptcp dss ack 3554131263], length 0
   98  00:40:07.071206 IP 52.41.70.31.5201 > 10.42.53.132.50002: Flags [P.], seq 14001:15025, ack 16001, win 884, options [nop,nop,TS val 3534644412 ecr 3192560762,mptcp dss ack 3554131263 seq 1179784297 subseq 14001 len 1024 csum 0x79ab], length 1024
   99  00:40:07.071499 IP 10.42.53.132.50002 > 52.41.70.31.5201: Flags [.], ack 15025, win 8177, options [nop,nop,TS val 3192560791 ecr 3534644412,mptcp dss ack 1179785321], length 0
  100  00:40:07.096491 IP 52.41.70.31.5201 > 10.42.53.132.50002: Flags [P.], seq 15025:16001, ack 16001, win 884, options [nop,nop,TS val 3534644438 ecr 3192560762,mptcp dss ack 3554131263 seq 1179785321 subseq 15025 len 976 csum 0x8ff9], length 976
  101  00:40:07.096704 IP 10.42.53.132.50002 > 52.41.70.31.5201: Flags [.], ack 16001, win 8179, options [nop,nop,TS val 3192560816 ecr 3534644438,mptcp dss ack 1179786297], length 0
  102  00:40:07.312680 IP 10.42.53.132.50002 > 52.41.70.31.5201: Flags [.], seq 16001:17429, ack 16001, win 8209, options [nop,nop,TS val 3192561031 ecr 3534644438,mptcp dss ack 1179786297 seq 3554131263 subseq 16001 len 2000 csum 0xf30f], length 1428
  103  00:40:07.313018 IP 10.42.53.132.50002 > 52.41.70.31.5201: Flags [P.], seq 17429:18001, ack 16001, win 8209, options [nop,nop,TS val 3192561031 ecr 3534644438,mptcp dss ack 1179786297 seq 3554131263 subseq 16001 len 2000 csum 0xf30f], length 572
  104  00:40:07.345249 IP 52.41.70.31.5201 > 10.42.53.132.50002: Flags [.], ack 18001, win 884, options [nop,nop,TS val 3534644686 ecr 3192561031,mptcp dss ack 3554133263], length 0
  105  00:40:07.345256 IP 52.41.70.31.5201 > 10.42.53.132.50002: Flags [P.], seq 16001:17025, ack 18001, win 884, options [nop,nop,TS val 3534644686 ecr 3192561031,mptcp dss ack 3554133263 seq 1179786297 subseq 16001 len 1024 csum 0x6a0b], length 1024
  106  00:40:07.345528 IP 10.42.53.132.50002 > 52.41.70.31.5201: Flags [.], ack 17025, win 8177, options [nop,nop,TS val 3192561065 ecr 3534644686,mptcp dss ack 1179787321], length 0
  107  00:40:07.370442 IP 52.41.70.31.5201 > 10.42.53.132.50002: Flags [P.], seq 17025:18001, ack 18001, win 884, options [nop,nop,TS val 3534644711 ecr 3192561031,mptcp dss ack 3554133263 seq 1179787321 subseq 17025 len 976 csum 0x8059], length 976
  108  00:40:07.370666 IP 10.42.53.132.50002 > 52.41.70.31.5201: Flags [.], ack 18001, win 8179, options [nop,nop,TS val 3192561090 ecr 3534644711,mptcp dss ack 1179788297], length 0
  109  00:40:07.581341 IP 10.42.53.132.50002 > 52.41.70.31.5201: Flags [.], seq 18001:19429, ack 18001, win 8209, options [nop,nop,TS val 3192561300 ecr 3534644711,mptcp dss ack 1179788297 seq 3554133263 subseq 18001 len 2000 csum 0xe36f], length 1428
  110  00:40:07.581798 IP 10.42.53.132.50002 > 52.41.70.31.5201: Flags [P.], seq 19429:20001, ack 18001, win 8209, options [nop,nop,TS val 3192561300 ecr 3534644711,mptcp dss ack 1179788297 seq 3554133263 subseq 18001 len 2000 csum 0xe36f], length 572
  111  00:40:07.608129 IP 52.41.70.31.5201 > 10.42.53.132.50002: Flags [.], ack 20001, win 884, options [nop,nop,TS val 3534644949 ecr 3192561300,mptcp dss ack 3554135263], length 0
  112  00:40:07.608137 IP 52.41.70.31.5201 > 10.42.53.132.50002: Flags [P.], seq 18001:19025, ack 20001, win 884, options [nop,nop,TS val 3534644949 ecr 3192561300,mptcp dss ack 3554135263 seq 1179788297 subseq 18001 len 1024 csum 0x5a6b], length 1024
  113  00:40:07.608408 IP 10.42.53.132.50002 > 52.41.70.31.5201: Flags [.], ack 19025, win 8177, options [nop,nop,TS val 3192561328 ecr 3534644949,mptcp dss ack 1179789321], length 0
  114  00:40:07.632852 IP 52.41.70.31.5201 > 10.42.53.132.50002: Flags [P.], seq 19025:20001, ack 20001, win 884, options [nop,nop,TS val 3534644974 ecr 3192561300,mptcp dss ack 3554135263 seq 1179789321 subseq 19025 len 976 csum 0x70b9], length 976
  115  00:40:07.633058 IP 10.42.53.132.50002 > 52.41.70.31.5201: Flags [.], ack 20001, win 8179, options [nop,nop,TS val 3192561352 ecr 3534644974,mptcp dss ack 1179790297], length 0
  116  00:40:07.641228 IP6 2607:fb90:3635:797b:5986:1647:4961:b852.50003 > 2607:7700:0:13::3429:461f.5201: Flags [F.], seq 1, ack 1, win 8209, options [nop,nop,TS val 590902356 ecr 1772841860,mptcp dss fin ack 1179790297 seq 3554135263 subseq 0 len 1 csum 0x10a7], length 0
  117  00:40:07.641620 IP 10.42.53.132.50002 > 52.41.70.31.5201: Flags [F.], seq 20001, ack 20001, win 8209, options [nop,nop,TS val 3192561360 ecr 3534644974,mptcp dss fin ack 1179790297 seq 3554135263 subseq 0 len 1 csum 0x10a7], length 0
  118  00:40:07.666951 IP 52.41.70.31.5201 > 10.42.53.132.50002: Flags [.], ack 20002, win 884, options [nop,nop,TS val 3534645008 ecr 3192561360,mptcp dss ack 3554135264], length 0
  119  00:40:07.666958 IP 52.41.70.31.5201 > 10.42.53.132.50002: Flags [F.], seq 20001, ack 20002, win 884, options [nop,nop,TS val 3534645008 ecr 3192561360,mptcp dss fin ack 3554135264 seq 1179790297 subseq 0 len 1 csum 0x1f6e], length 0
  120  00:40:07.667330 IP 10.42.53.132.50002 > 52.41.70.31.5201: Flags [.], ack 20002, win 8209, options [nop,nop,TS val 3192561386 ecr 3534645008,mptcp dss ack 1179790298], length 0
  121  00:40:07.752478 IP6 2607:7700:0:13::3429:461f.5201 > 2607:fb90:3635:797b:5986:1647:4961:b852.50003: Flags [F.], seq 1, ack 2, win 884, options [nop,nop,TS val 1772844115 ecr 590902356,mptcp dss ack 3554135264], length 0
  122  00:40:07.752858 IP6 2607:fb90:3635:797b:5986:1647:4961:b852.50003 > 2607:7700:0:13::3429:461f.5201: Flags [.], ack 2, win 8209, options [nop,nop,TS val 590902468 ecr 1772844115,mptcp dss ack 1179790298], length 0
  123  00:41:39.528321 IP 10.42.53.132.50004 > 52.41.70.31.5201: Flags [SEW], seq 2889004778, win 65535, options [mss 1460,nop,wscale 5,mptcp capable v1,nop,nop,TS val 1952099318 ecr 0,sackOK,eol], length 0
  124  00:41:39.567522 IP 52.41.70.31.5201 > 10.42.53.132.50004: Flags [S.E], seq 851672643, ack 2889004779, win 62503, options [mss 1460,sackOK,TS val 3534736900 ecr 1952099318,nop,wscale 7,mptcp capable v1 csum {0x288a718919d7fdeb}], length 0
  125  00:41:39.567964 IP 10.42.53.132.50004 > 52.41.70.31.5201: Flags [.], ack 1, win 4096, options [nop,nop,TS val 1952099358 ecr 3534736900,mptcp capable v1 csum {0x2d2800beb7b89352,0x288a718919d7fdeb}], length 0
  126  00:41:39.826245 IP 10.42.53.132.50004 > 52.41.70.31.5201: Flags [.], seq 1:1429, ack 1, win 4096, options [nop,nop,TS val 1952099616 ecr 3534736900,mptcp dss ack 621856857 seq 4042235108 subseq 1 len 2000 csum 0x2f61], length 1428
  127  00:41:39.826772 IP 10.42.53.132.50004 > 52.41.70.31.5201: Flags [P.], seq 1429:2001, ack 1, win 4096, options [nop,nop,TS val 1952099616 ecr 3534736900,mptcp dss ack 621856857 seq 4042235108 subseq 1 len 2000 csum 0x2f61], length 572
  128  00:41:39.862643 IP 52.41.70.31.5201 > 10.42.53.132.50004: Flags [.], ack 1429, win 489, options [nop,nop,TS val 3534737201 ecr 1952099616,mptcp dss ack 836911334], length 0
  129  00:41:39.862651 IP 52.41.70.31.5201 > 10.42.53.132.50004: Flags [.], ack 2001, win 489, options [nop,nop,TS val 3534737201 ecr 1952099616,mptcp dss ack 836911334], length 0
  130  00:41:40.085300 IP 10.42.53.132.50004 > 52.41.70.31.5201: Flags [.], seq 2001:3429, ack 1, win 4096, options [nop,nop,TS val 1952099875 ecr 3534737201,mptcp dss ack 621856857 seq 4042237108 subseq 2001 len 2000 csum 0x1fc1], length 1428
  131  00:41:40.085711 IP 10.42.53.132.50004 > 52.41.70.31.5201: Flags [P.], seq 3429:4001, ack 1, win 4096, options [nop,nop,TS val 1952099875 ecr 3534737201,mptcp dss ack 621856857 seq 4042237108 subseq 2001 len 2000 csum 0x1fc1], length 572
  132  00:41:40.121577 IP 52.41.70.31.5201 > 10.42.53.132.50004: Flags [.], ack 4001, win 489, options [nop,nop,TS val 3534737460 ecr 1952099875,mptcp dss ack 836911334], length 0
  133  00:41:40.362225 IP 10.42.53.132.50004 > 52.41.70.31.5201: Flags [.], seq 4001:5429, ack 1, win 4096, options [nop,nop,TS val 1952100152 ecr 3534737460,mptcp dss ack 621856857 seq 4042239108 subseq 4001 len 2000 csum 0x1021], length 1428
  134  00:41:40.362784 IP 10.42.53.132.50004 > 52.41.70.31.5201: Flags [P.], seq 5429:6001, ack 1, win 4096, options [nop,nop,TS val 1952100152 ecr 3534737460,mptcp dss ack 621856857 seq 4042239108 subseq 4001 len 2000 csum 0x1021], length 572
  135  00:41:40.396292 IP 52.41.70.31.5201 > 10.42.53.132.50004: Flags [.], ack 6001, win 489, options [nop,nop,TS val 3534737734 ecr 1952100152,mptcp dss ack 836911334], length 0
  136  00:41:40.619074 IP 10.42.53.132.50004 > 52.41.70.31.5201: Flags [.], seq 6001:7429, ack 1, win 4096, options [nop,nop,TS val 1952100409 ecr 3534737734,mptcp dss ack 621856857 seq 4042241108 subseq 6001 len 2000 csum 0x81], length 1428
  137  00:41:40.619458 IP 10.42.53.132.50004 > 52.41.70.31.5201: Flags [P.], seq 7429:8001, ack 1, win 4096, options [nop,nop,TS val 1952100409 ecr 3534737734,mptcp dss ack 621856857 seq 4042241108 subseq 6001 len 2000 csum 0x81], length 572
  138  00:41:40.652055 IP 52.41.70.31.5201 > 10.42.53.132.50004: Flags [.], ack 7429, win 489, options [nop,nop,TS val 3534737991 ecr 1952100409,mptcp dss ack 836911334], length 0
  139  00:41:40.652062 IP 52.41.70.31.5201 > 10.42.53.132.50004: Flags [.], ack 8001, win 489, options [nop,nop,TS val 3534737991 ecr 1952100409,mptcp dss ack 836911334], length 0
  140  00:41:40.882454 IP 10.42.53.132.50004 > 52.41.70.31.5201: Flags [.], seq 8001:9429, ack 1, win 4096, options [nop,nop,TS val 1952100673 ecr 3534737991,mptcp dss ack 621856857 seq 4042243108 subseq 8001 len 2000 csum 0xf0e0], length 1428
  141  00:41:40.883003 IP 10.42.53.132.50004 > 52.41.70.31.5201: Flags [P.], seq 9429:10001, ack 1, win 4096, options [nop,nop,TS val 1952100673 ecr 3534737991,mptcp dss ack 621856857 seq 4042243108 subseq 8001 len 2000 csum 0xf0e0], length 572
  142  00:41:40.915945 IP 52.41.70.31.5201 > 10.42.53.132.50004: Flags [.], ack 10001, win 489, options [nop,nop,TS val 3534738254 ecr 1952100673,mptcp dss ack 836911334], length 0
  143  00:41:41.156718 IP 10.42.53.132.50004 > 52.41.70.31.5201: Flags [.], seq 10001:11429, ack 1, win 4096, options [nop,nop,TS val 1952100947 ecr 3534738254,mptcp dss ack 621856857 seq 4042245108 subseq 10001 len 2000 csum 0xe140], length 1428
  144  00:41:41.157100 IP 10.42.53.132.50004 > 52.41.70.31.5201: Flags [P.], seq 11429:12001, ack 1, win 4096, options [nop,nop,TS val 1952100947 ecr 3534738254,mptcp dss ack 621856857 seq 4042245108 subseq 10001 len 2000 csum 0xe140], length 572
  145  00:41:41.190456 IP 52.41.70.31.5201 > 10.42.53.132.50004: Flags [.], ack 11429, win 489, options [nop,nop,TS val 3534738529 ecr 1952100947,mptcp dss ack 836911334], length 0
  146  00:41:41.190464 IP 52.41.70.31.5201 > 10.42.53.132.50004: Flags [.], ack 12001, win 489, options [nop,nop,TS val 3534738529 ecr 1952100947,mptcp dss ack 836911334], length 0
  147  00:41:41.409912 IP 10.42.53.132.50004 > 52.41.70.31.5201: Flags [.], seq 12001:13429, ack 1, win 4096, options [nop,nop,TS val 1952101200 ecr 3534738529,mptcp dss ack 621856857 seq 4042247108 subseq 12001 len 2000 csum 0xd1a0], length 1428
  148  00:41:41.410424 IP 10.42.53.132.50004 > 52.41.70.31.5201: Flags [P.], seq 13429:14001, ack 1, win 4096, options [nop,nop,TS val 1952101200 ecr 3534738529,mptcp dss ack 621856857 seq 4042247108 subseq 12001 len 2000 csum 0xd1a0], length 572
  149  00:41:41.443785 IP 52.41.70.31.5201 > 10.42.53.132.50004: Flags [.], ack 14001, win 489, options [nop,nop,TS val 3534738782 ecr 1952101200,mptcp dss ack 836911334], length 0
  150  00:41:41.664590 IP 10.42.53.132.50004 > 52.41.70.31.5201: Flags [.], seq 14001:15429, ack 1, win 4096, options [nop,nop,TS val 1952101455 ecr 3534738782,mptcp dss ack 621856857 seq 4042249108 subseq 14001 len 2000 csum 0xc200], length 1428
  151  00:41:41.664939 IP 10.42.53.132.50004 > 52.41.70.31.5201: Flags [P.], seq 15429:16001, ack 1, win 4096, options [nop,nop,TS val 1952101455 ecr 3534738782,mptcp dss ack 621856857 seq 4042249108 subseq 14001 len 2000 csum 0xc200], length 572
  152  00:41:41.695468 IP 52.41.70.31.5201 > 10.42.53.132.50004: Flags [.], ack 16001, win 489, options [nop,nop,TS val 3534739034 ecr 1952101455,mptcp dss ack 836911334], length 0
  153  00:41:41.940402 IP 10.42.53.132.50004 > 52.41.70.31.5201: Flags [.], seq 16001:17429, ack 1, win 4096, options [nop,nop,TS val 1952101730 ecr 3534739034,mptcp dss ack 621856857 seq 4042251108 subseq 16001 len 2000 csum 0xb260], length 1428
  154  00:41:41.940776 IP 10.42.53.132.50004 > 52.41.70.31.5201: Flags [P.], seq 17429:18001, ack 1, win 4096, options [nop,nop,TS val 1952101730 ecr 3534739034,mptcp dss ack 621856857 seq 4042251108 subseq 16001 len 2000 csum 0xb260], length 572
  155  00:41:41.974347 IP 52.41.70.31.5201 > 10.42.53.132.50004: Flags [.], ack 17429, win 489, options [nop,nop,TS val 3534739312 ecr 1952101730,mptcp dss ack 836911334], length 0
  156  00:41:41.974356 IP 52.41.70.31.5201 > 10.42.53.132.50004: Flags [.], ack 18001, win 489, options [nop,nop,TS val 3534739312 ecr 1952101730,mptcp dss ack 836911334], length 0
  157  00:41:42.216098 IP 10.42.53.132.50004 > 52.41.70.31.5201: Flags [.], seq 18001:19429, ack 1, win 4096, options [nop,nop,TS val 1952102005 ecr 3534739312,mptcp dss ack 621856857 seq 4042253108 subseq 18001 len 2000 csum 0xa2c0], length 1428
  158  00:41:42.216470 IP 10.42.53.132.50004 > 52.41.70.31.5201: Flags [P.], seq 19429:20001, ack 1, win 4096, options [nop,nop,TS val 1952102005 ecr 3534739312,mptcp dss ack 621856857 seq 4042253108 subseq 18001 len 2000 csum 0xa2c0], length 572
  159  00:41:42.250046 IP 52.41.70.31.5201 > 10.42.53.132.50004: Flags [.], ack 20001, win 489, options [nop,nop,TS val 3534739588 ecr 1952102005,mptcp dss ack 836911334], length 0
  160  00:41:57.304307 IP 10.42.53.132.50004 > 52.41.70.31.5201: Flags [F.], seq 20001, ack 1, win 4096, options [nop,nop,TS val 1952117094 ecr 3534739588,mptcp dss fin ack 621856857 seq 4042255108 subseq 0 len 1 csum 0xcff7], length 0
  161  00:41:57.436317 IP 52.41.70.31.5201 > 10.42.53.132.50004: Flags [.], ack 20002, win 489, options [nop,nop,TS val 3534754718 ecr 1952117094,mptcp dss ack 836911334], length 0
  162  00:42:01.289612 IP 10.42.53.132.50005 > 52.41.70.31.5201: Flags [SEW], seq 3773645235, win 65535, options [mss 1460,nop,wscale 5,mptcp capable v1,nop,nop,TS val 2686559159 ecr 0,sackOK,eol], length 0
  163  00:42:01.323276 IP 52.41.70.31.5201 > 10.42.53.132.50005: Flags [S.E], seq 1639751572, ack 3773645236, win 62503, options [mss 1460,sackOK,TS val 3534758662 ecr 2686559159,nop,wscale 7,mptcp capable v1 csum {0x95371f3c9bffaccb}], length 0
  164  00:42:01.323698 IP 10.42.53.132.50005 > 52.41.70.31.5201: Flags [.], ack 1, win 4096, options [nop,nop,TS val 2686559193 ecr 3534758662,mptcp capable v1 csum {0x71364d262a7d35fd,0x95371f3c9bffaccb}], length 0
  165  00:42:01.601540 IP 10.42.53.132.50005 > 52.41.70.31.5201: Flags [.], seq 1:1429, ack 1, win 4096, options [nop,nop,TS val 2686559471 ecr 3534758662,mptcp dss ack 2141456551 seq 1460776725 subseq 1 len 2000 csum 0x3eab], length 1428
  166  00:42:01.601991 IP 10.42.53.132.50005 > 52.41.70.31.5201: Flags [P.], seq 1429:2001, ack 1, win 4096, options [nop,nop,TS val 2686559471 ecr 3534758662,mptcp dss ack 2141456551 seq 1460776725 subseq 1 len 2000 csum 0x3eab], length 572
  167  00:42:01.637398 IP 52.41.70.31.5201 > 10.42.53.132.50005: Flags [.], ack 2001, win 489, options [nop,nop,TS val 3534758976 ecr 2686559471,mptcp dss ack 2841823246], length 0
  168  00:42:01.875255 IP 10.42.53.132.50005 > 52.41.70.31.5201: Flags [.], seq 2001:3429, ack 1, win 4096, options [nop,nop,TS val 2686559745 ecr 3534758976,mptcp dss ack 2141456551 seq 1460778725 subseq 2001 len 2000 csum 0x2f0b], length 1428
  169  00:42:01.875759 IP 10.42.53.132.50005 > 52.41.70.31.5201: Flags [P.], seq 3429:4001, ack 1, win 4096, options [nop,nop,TS val 2686559745 ecr 3534758976,mptcp dss ack 2141456551 seq 1460778725 subseq 2001 len 2000 csum 0x2f0b], length 572
  170  00:42:01.910824 IP 52.41.70.31.5201 > 10.42.53.132.50005: Flags [.], ack 3429, win 489, options [nop,nop,TS val 3534759250 ecr 2686559745,mptcp dss ack 2841823246], length 0
  171  00:42:01.910833 IP 52.41.70.31.5201 > 10.42.53.132.50005: Flags [.], ack 4001, win 489, options [nop,nop,TS val 3534759250 ecr 2686559745,mptcp dss ack 2841823246], length 0
  172  00:42:02.144071 IP 10.42.53.132.50005 > 52.41.70.31.5201: Flags [.], seq 4001:5429, ack 1, win 4096, options [nop,nop,TS val 2686560013 ecr 3534759250,mptcp dss ack 2141456551 seq 1460780725 subseq 4001 len 2000 csum 0x1f6b], length 1428
  173  00:42:02.144471 IP 10.42.53.132.50005 > 52.41.70.31.5201: Flags [P.], seq 5429:6001, ack 1, win 4096, options [nop,nop,TS val 2686560013 ecr 3534759250,mptcp dss ack 2141456551 seq 1460780725 subseq 4001 len 2000 csum 0x1f6b], length 572
  174  00:42:02.174409 IP 52.41.70.31.5201 > 10.42.53.132.50005: Flags [.], ack 6001, win 489, options [nop,nop,TS val 3534759513 ecr 2686560013,mptcp dss ack 2841823246], length 0
  175  00:42:02.416732 IP 10.42.53.132.50005 > 52.41.70.31.5201: Flags [.], seq 6001:7429, ack 1, win 4096, options [nop,nop,TS val 2686560286 ecr 3534759513,mptcp dss ack 2141456551 seq 1460782725 subseq 6001 len 2000 csum 0xfcb], length 1428
  176  00:42:02.417242 IP 10.42.53.132.50005 > 52.41.70.31.5201: Flags [P.], seq 7429:8001, ack 1, win 4096, options [nop,nop,TS val 2686560286 ecr 3534759513,mptcp dss ack 2141456551 seq 1460782725 subseq 6001 len 2000 csum 0xfcb], length 572
  177  00:42:02.449841 IP 52.41.70.31.5201 > 10.42.53.132.50005: Flags [.], ack 8001, win 489, options [nop,nop,TS val 3534759789 ecr 2686560286,mptcp dss ack 2841823246], length 0
  178  00:42:02.690205 IP 10.42.53.132.50005 > 52.41.70.31.5201: Flags [.], seq 8001:9429, ack 1, win 4096, options [nop,nop,TS val 2686560559 ecr 3534759789,mptcp dss ack 2141456551 seq 1460784725 subseq 8001 len 2000 csum 0x2b], length 1428
  179  00:42:02.690700 IP 10.42.53.132.50005 > 52.41.70.31.5201: Flags [P.], seq 9429:10001, ack 1, win 4096, options [nop,nop,TS val 2686560559 ecr 3534759789,mptcp dss ack 2141456551 seq 1460784725 subseq 8001 len 2000 csum 0x2b], length 572
  180  00:42:02.723984 IP 52.41.70.31.5201 > 10.42.53.132.50005: Flags [.], ack 10001, win 489, options [nop,nop,TS val 3534760063 ecr 2686560559,mptcp dss ack 2841823246], length 0
  181  00:42:02.966259 IP 10.42.53.132.50005 > 52.41.70.31.5201: Flags [.], seq 10001:11429, ack 1, win 4096, options [nop,nop,TS val 2686560836 ecr 3534760063,mptcp dss ack 2141456551 seq 1460786725 subseq 10001 len 2000 csum 0xf08a], length 1428
  182  00:42:02.966615 IP 10.42.53.132.50005 > 52.41.70.31.5201: Flags [P.], seq 11429:12001, ack 1, win 4096, options [nop,nop,TS val 2686560836 ecr 3534760063,mptcp dss ack 2141456551 seq 1460786725 subseq 10001 len 2000 csum 0xf08a], length 572
  183  00:42:02.997591 IP 52.41.70.31.5201 > 10.42.53.132.50005: Flags [.], ack 12001, win 489, options [nop,nop,TS val 3534760337 ecr 2686560836,mptcp dss ack 2841823246], length 0
  184  00:42:03.240115 IP 10.42.53.132.50005 > 52.41.70.31.5201: Flags [.], seq 12001:13429, ack 1, win 4096, options [nop,nop,TS val 2686561109 ecr 3534760337,mptcp dss ack 2141456551 seq 1460788725 subseq 12001 len 2000 csum 0xe0ea], length 1428
  185  00:42:03.240590 IP 10.42.53.132.50005 > 52.41.70.31.5201: Flags [P.], seq 13429:14001, ack 1, win 4096, options [nop,nop,TS val 2686561109 ecr 3534760337,mptcp dss ack 2141456551 seq 1460788725 subseq 12001 len 2000 csum 0xe0ea], length 572
  186  00:42:03.273090 IP 52.41.70.31.5201 > 10.42.53.132.50005: Flags [.], ack 14001, win 489, options [nop,nop,TS val 3534760613 ecr 2686561109,mptcp dss ack 2841823246], length 0
  187  00:42:03.511955 IP 10.42.53.132.50005 > 52.41.70.31.5201: Flags [.], seq 14001:15429, ack 1, win 4096, options [nop,nop,TS val 2686561381 ecr 3534760613,mptcp dss ack 2141456551 seq 1460790725 subseq 14001 len 2000 csum 0xd14a], length 1428
  188  00:42:03.512338 IP 10.42.53.132.50005 > 52.41.70.31.5201: Flags [P.], seq 15429:16001, ack 1, win 4096, options [nop,nop,TS val 2686561381 ecr 3534760613,mptcp dss ack 2141456551 seq 1460790725 subseq 14001 len 2000 csum 0xd14a], length 572
  189  00:42:03.545396 IP 52.41.70.31.5201 > 10.42.53.132.50005: Flags [.], ack 16001, win 489, options [nop,nop,TS val 3534760885 ecr 2686561381,mptcp dss ack 2841823246], length 0
  190  00:42:03.784644 IP 10.42.53.132.50005 > 52.41.70.31.5201: Flags [.], seq 16001:17429, ack 1, win 4096, options [nop,nop,TS val 2686561654 ecr 3534760885,mptcp dss ack 2141456551 seq 1460792725 subseq 16001 len 2000 csum 0xc1aa], length 1428
  191  00:42:03.785013 IP 10.42.53.132.50005 > 52.41.70.31.5201: Flags [P.], seq 17429:18001, ack 1, win 4096, options [nop,nop,TS val 2686561654 ecr 3534760885,mptcp dss ack 2141456551 seq 1460792725 subseq 16001 len 2000 csum 0xc1aa], length 572
  192  00:42:03.817515 IP 52.41.70.31.5201 > 10.42.53.132.50005: Flags [.], ack 18001, win 489, options [nop,nop,TS val 3534761157 ecr 2686561654,mptcp dss ack 2841823246], length 0
  193  00:42:04.058293 IP 10.42.53.132.50005 > 52.41.70.31.5201: Flags [.], seq 18001:19429, ack 1, win 4096, options [nop,nop,TS val 2686561927 ecr 3534761157,mptcp dss ack 2141456551 seq 1460794725 subseq 18001 len 2000 csum 0xb20a], length 1428
  194  00:42:04.058807 IP 10.42.53.132.50005 > 52.41.70.31.5201: Flags [P.], seq 19429:20001, ack 1, win 4096, options [nop,nop,TS val 2686561927 ecr 3534761157,mptcp dss ack 2141456551 seq 1460794725 subseq 18001 len 2000 csum 0xb20a], length 572
  195  00:42:04.092001 IP 52.41.70.31.5201 > 10.42.53.132.50005: Flags [.], ack 20001, win 489, options [nop,nop,TS val 3534761431 ecr 2686561927,mptcp dss ack 2841823246], length 0
  196  00:42:34.386019 IP 10.42.53.132.50005 > 52.41.70.31.5201: Flags [F.], seq 20001, ack 1, win 4096, options [nop,nop,TS val 2686592255 ecr 3534761431,mptcp dss fin ack 2141456551 seq 1460796725 subseq 0 len 1 csum 0xdf41], length 0
  197  00:42:34.506872 IP 52.41.70.31.5201 > 10.42.53.132.50005: Flags [.], ack 20002, win 489, options [nop,nop,TS val 3534791798 ecr 2686592255,mptcp dss ack 2841823246], length 0
